{
  "name": "Shadow of Sir Garran",
  "size": "Medium",
  "type": "Undead",
  "alignment": "Chaotic Evil",
  "armorClass": 16,
  "hitPoints": 90,
  "maxHitPoints": 90,
  "speed": 40,
  "abilities": {
    "strength": 16,
    "dexterity": 18,
    "constitution": 15,
    "intelligence": 12,
    "wisdom": 14,
    "charisma": 17
  },
  "savingThrows": [
    "DEX",
    "CHA",
    "WIS"
  ],
  "skills": {
    "Stealth": 9,
    "Perception": 6,
    "Intimidation": 7
  },
  "damageVulnerabilities": [
    "radiant"
  ],
  "damageResistances": [
    "acid",
    "cold",
    "fire",
    "lightning",
    "thunder",
    "bludgeoning",
    "piercing",
    "slashing from nonmagical attacks"
  ],
  "damageImmunities": [
    "necrotic",
    "poison"
  ],
  "conditionImmunities": [
    "charmed",
    "exhaustion",
    "frightened",
    "grappled",
    "paralyzed",
    "petrified",
    "poisoned",
    "prone",
    "restrained"
  ],
  "senses": {
    "darkvision": 120,
    "passivePerception": 16
  },
  "languages": "Common, understands all languages it knew in life but can't speak",
  "challengeRating": 7,
  "specialAbilities": [
    {
      "name": "Incorporeal Movement",
      "attackBonus": 0,
      "damageDice": "0",
      "damageBonus": 0,
      "damageType": "none"
    },
    {
      "name": "Shadow Stealth",
      "attackBonus": 0,
      "damageDice": "0",
      "damageBonus": 0,
      "damageType": "none"
    },
    {
      "name": "Life Drain",
      "attackBonus": 7,
      "damageDice": "3d8",
      "damageBonus": 3,
      "damageType": "necrotic"
    }
  ],
  "actions": [
    {
      "name": "Shadow Blade",
      "attackBonus": 8,
      "damageDice": "2d8",
      "damageBonus": 4,
      "damageType": "necrotic"
    },
    {
      "name": "Chilling Touch",
      "attackBonus": 7,
      "damageDice": "2d6",
      "damageBonus": 2,
      "damageType": "cold"
    }
  ],
  "legendaryActions": [
    {
      "name": "Fade Into Darkness",
      "description": "The Shadow of Sir Garran becomes invisible until the start of its next turn or until it attacks."
    },
    {
      "name": "Shadow Step",
      "description": "The Shadow of Sir Garran magically teleports up to 30 feet to an unoccupied space it can see that is in dim light or darkness."
    },
    {
      "name": "Haunting Wail",
      "description": "Each creature of its choice within 30 feet that can hear it must succeed on a DC 16 Wisdom saving throw or be frightened until the end of its next turn."
    }
  ],
  "condition": "Alive"
}