{
  "$schema": "http://json-schema.org/draft-07/schema#",
  "name": "Goblin",
  "size": "Small",
  "type": "humanoid",
  "alignment": "neutral evil",
  "armorClass": 15,
  "hitPoints": 7,
  "maxHitPoints": 7,
  "speed": 30,
  "abilities": {
    "strength": 8,
    "dexterity": 14,
    "constitution": 10,
    "intelligence": 10,
    "wisdom": 8,
    "charisma": 8
  },
  "savingThrows": [],
  "skills": {
    "stealth": 6,
    "athletics": -1
  },
  "damageVulnerabilities": [],
  "damageResistances": [],
  "damageImmunities": [],
  "conditionImmunities": [],
  "senses": {
    "darkvision": 60,
    "passivePerception": 9
  },
  "languages": "Common, Goblin",
  "challengeRating": 0.25,
  "specialAbilities": [
    {
      "name": "Nimble Escape",
      "attackBonus": 0,
      "damageDice": "0d0",
      "damageBonus": 0,
      "damageType": ""
    }
  ],
  "actions": [
    {
      "name": "Scimitar",
      "attackBonus": 4,
      "damageDice": "1d6",
      "damageBonus": 2,
      "damageType": "slashing"
    },
    {
      "name": "Shortbow",
      "attackBonus": 4,
      "damageDice": "1d6",
      "damageBonus": 2,
      "damageType": "piercing"
    }
  ],
  "legendaryActions": [],
  "condition": "Alive"
}