{
  "name": "Animated Armor",
  "size": "Medium",
  "type": "Construct",
  "alignment": "Unaligned",
  "armorClass": 18,
  "hitPoints": 33,
  "maxHitPoints": 33,
  "speed": 25,
  "abilities": {
    "strength": 14,
    "dexterity": 11,
    "constitution": 13,
    "intelligence": 1,
    "wisdom": 3,
    "charisma": 1
  },
  "savingThrows": [],
  "skills": {},
  "damageVulnerabilities": [],
  "damageResistances": [
    "bludgeoning",
    "piercing",
    "slashing"
  ],
  "damageImmunities": [
    "poison",
    "psychic"
  ],
  "conditionImmunities": [
    "blinded",
    "charmed",
    "deafened",
    "frightened",
    "paralyzed",
    "petrified",
    "poisoned"
  ],
  "senses": {
    "darkvision": 60,
    "passivePerception": 6
  },
  "languages": "",
  "challengeRating": 1,
  "specialAbilities": [
    {
      "name": "Antimagic Susceptibility",
      "attackBonus": 0,
      "damageDice": "0d0",
      "damageBonus": 0,
      "damageType": "None"
    },
    {
      "name": "False Appearance",
      "attackBonus": 0,
      "damageDice": "0d0",
      "damageBonus": 0,
      "damageType": "None"
    }
  ],
  "actions": [
    {
      "name": "Multiattack",
      "attackBonus": 0,
      "damageDice": "0d0",
      "damageBonus": 0,
      "damageType": "None"
    },
    {
      "name": "Slam",
      "attackBonus": 4,
      "damageDice": "1d6",
      "damageBonus": 2,
      "damageType": "bludgeoning"
    }
  ],
  "legendaryActions": [],
  "condition": "Alive"
}