{
    "name": "Rat",
    "size": "Tiny",
    "type": "beast",
    "alignment": "unaligned",
    "armorClass": 10,
    "hitPoints": 1,
    "speed": 20,
    "abilities": {
      "strength": 2,
      "dexterity": 11,
      "constitution": 9,
      "intelligence": 2,
      "wisdom": 10,
      "charisma": 4
    },
    "savingThrows": [],
    "skills": {
      "stealth": 2
    },
    "damageVulnerabilities": [],
    "damageResistances": [],
    "damageImmunities": [],
    "conditionImmunities": [],
    "senses": {
      "darkvision": 30,
      "passivePerception": 10
    },
    "languages": "",
    "challengeRating": 0,
    "specialAbilities": [
      {
        "name": "Keen Smell",
        "attackBonus": 0,
        "damageDice": "",
        "damageBonus": 0,
        "damageType": ""
      }
    ],
    "actions": [
      {
        "name": "Bite",
        "attackBonus": 0,
        "damageDice": "1d1",
        "damageBonus": 0,
        "damageType": "piercing"
      }
    ],
    "legendaryActions": [],
    "condition": "Alive"
  }