{
  "name": "Animated Weapon",
  "size": "Small",
  "type": "Construct",
  "alignment": "Unaligned",
  "armorClass": 17,
  "hitPoints": 27,
  "maxHitPoints": 27,
  "speed": 30,
  "abilities": {
    "strength": 12,
    "dexterity": 18,
    "constitution": 13,
    "intelligence": 1,
    "wisdom": 5,
    "charisma": 1
  },
  "savingThrows": [],
  "skills": {},
  "damageVulnerabilities": [],
  "damageResistances": [
    "bludgeoning",
    "piercing",
    "slashing"
  ],
  "damageImmunities": [
    "poison",
    "psychic"
  ],
  "conditionImmunities": [
    "blinded",
    "charmed",
    "deafened",
    "frightened",
    "paralyzed",
    "petrified",
    "poisoned"
  ],
  "senses": {
    "darkvision": 60,
    "passivePerception": 7
  },
  "languages": "",
  "challengeRating": 1,
  "specialAbilities": [
    {
      "name": "Antimagic Susceptibility",
      "attackBonus": 0,
      "damageDice": "0",
      "damageBonus": 0,
      "damageType": "None"
    },
    {
      "name": "False Appearance",
      "attackBonus": 0,
      "damageDice": "0",
      "damageBonus": 0,
      "damageType": "None"
    }
  ],
  "actions": [
    {
      "name": "Slash",
      "attackBonus": 5,
      "damageDice": "1d8",
      "damageBonus": 2,
      "damageType": "slashing"
    }
  ],
  "legendaryActions": [],
  "condition": "Alive"
}