{
  "name": "Animated Armor",
  "size": "Medium",
  "type": "Construct",
  "alignment": "Unaligned",
  "armorClass": 18,
  "hitPoints": 33,
  "maxHitPoints": 33,
  "speed": 25,
  "abilities": {
    "strength": 14,
    "dexterity": 11,
    "constitution": 13,
    "intelligence": 1,
    "wisdom": 3,
    "charisma": 1
  },
  "savingThrows": [],
  "skills": {},
  "damageVulnerabilities": [],
  "damageResistances": [
    "Piercing"
  ],
  "damageImmunities": [
    "Poison",
    "Psychic"
  ],
  "conditionImmunities": [
    "Blinded",
    "Charmed",
    "Deafened",
    "Exhaustion",
    "Frightened",
    "Paralyzed",
    "Petrified",
    "Poisoned"
  ],
  "senses": {
    "darkvision": 60,
    "passivePerception": 6
  },
  "languages": "",
  "challengeRating": 1,
  "specialAbilities": [
    {
      "name": "Antimagic Susceptibility",
      "attackBonus": 0,
      "damageDice": "",
      "damageBonus": 0,
      "damageType": "",
      "description": "The armor is incapacitated while in the area of an antimagic field. If targeted by dispel magic, the armor must succeed on a Constitution saving throw against the caster's spell save DC or fall unconscious for 1 minute."
    },
    {
      "name": "False Appearance",
      "attackBonus": 0,
      "damageDice": "",
      "damageBonus": 0,
      "damageType": "",
      "description": "While the armor remains motionless, it is indistinguishable from a normal suit of armor."
    }
  ],
  "actions": [
    {
      "name": "Multiattack",
      "attackBonus": 0,
      "damageDice": "",
      "damageBonus": 0,
      "damageType": "",
      "description": "The armor makes two melee attacks."
    },
    {
      "name": "Slam",
      "attackBonus": 4,
      "damageDice": "1d6+2",
      "damageBonus": 2,
      "damageType": "Bludgeoning"
    }
  ],
  "legendaryActions": [],
  "condition": "Alive"
}