{
  "name": "Giant Rat",
  "size": "Small",
  "type": "beast",
  "alignment": "unaligned",
  "armorClass": 12,
  "hitPoints": 7,
  "maxHitPoints": 7,
  "speed": 30,
  "abilities": {
    "strength": 7,
    "dexterity": 15,
    "constitution": 11,
    "intelligence": 2,
    "wisdom": 10,
    "charisma": 4
  },
  "savingThrows": [],
  "skills": {
    "perception": 2,
    "stealth": 2
  },
  "damageVulnerabilities": [],
  "damageResistances": [],
  "damageImmunities": [],
  "conditionImmunities": [],
  "senses": {
    "darkvision": 60,
    "passivePerception": 12
  },
  "languages": "",
  "challengeRating": 0.25,
  "specialAbilities": [
    {
      "name": "Keen Smell",
      "attackBonus": 0,
      "damageDice": "0d0",
      "damageBonus": 0,
      "damageType": "None"
    },
    {
      "name": "Pack Tactics",
      "attackBonus": 0,
      "damageDice": "0d0",
      "damageBonus": 0,
      "damageType": "None"
    }
  ],
  "actions": [
    {
      "name": "Bite",
      "attackBonus": 4,
      "damageDice": "1d4",
      "damageBonus": 2,
      "damageType": "piercing"
    }
  ],
  "legendaryActions": [],
  "condition": "Alive"
}