{
  "name": "Shadow Manifestations",
  "size": "Medium",
  "type": "undead",
  "alignment": "chaotic evil",
  "armorClass": 14,
  "hitPoints": 45,
  "maxHitPoints": 45,
  "speed": 40,
  "abilities": {
    "strength": 6,
    "dexterity": 16,
    "constitution": 13,
    "intelligence": 8,
    "wisdom": 12,
    "charisma": 14
  },
  "savingThrows": [
    "DEX",
    "CHA"
  ],
  "skills": {
    "Stealth": 7,
    "Perception": 3
  },
  "damageVulnerabilities": [
    "radiant"
  ],
  "damageResistances": [
    "acid",
    "cold",
    "fire",
    "lightning",
    "thunder",
    "bludgeoning",
    "piercing",
    "slashing from nonmagical attacks"
  ],
  "damageImmunities": [
    "necrotic",
    "poison"
  ],
  "conditionImmunities": [
    "charmed",
    "exhaustion",
    "frightened",
    "grappled",
    "paralyzed",
    "petrified",
    "poisoned",
    "prone",
    "restrained"
  ],
  "senses": {
    "darkvision": 60,
    "passivePerception": 13
  },
  "languages": "Understands the languages it knew in life but can't speak",
  "challengeRating": 3,
  "specialAbilities": [
    {
      "name": "Amorphous",
      "attackBonus": 0,
      "damageDice": "0d0",
      "damageBonus": 0,
      "damageType": "none"
    },
    {
      "name": "Shadow Stealth",
      "attackBonus": 0,
      "damageDice": "0d0",
      "damageBonus": 0,
      "damageType": "none"
    },
    {
      "name": "Sunlight Weakness",
      "attackBonus": 0,
      "damageDice": "0d0",
      "damageBonus": 0,
      "damageType": "none"
    }
  ],
  "actions": [
    {
      "name": "Shadowy Touch",
      "attackBonus": 5,
      "damageDice": "2d6",
      "damageBonus": 3,
      "damageType": "necrotic"
    },
    {
      "name": "Drain Strength",
      "attackBonus": 5,
      "damageDice": "1d4",
      "damageBonus": 0,
      "damageType": "strength reduction"
    }
  ],
  "legendaryActions": [
    {
      "name": "Fade Into Darkness",
      "description": "The Shadow Manifestations move up to half their speed without provoking opportunity attacks."
    },
    {
      "name": "Shadowy Displacement",
      "description": "The Shadow Manifestations become invisible until the start of their next turn or until after they attack."
    }
  ],
  "condition": "Alive"
}