{
  "name": "Swarm of Spiders",
  "size": "Medium",
  "type": "swarm of Tiny beasts",
  "alignment": "Unaligned",
  "armorClass": 12,
  "hitPoints": 22,
  "maxHitPoints": 22,
  "speed": 20,
  "abilities": {
    "strength": 3,
    "dexterity": 13,
    "constitution": 10,
    "intelligence": 1,
    "wisdom": 7,
    "charisma": 1
  },
  "savingThrows": [],
  "skills": {
    "Stealth": 4
  },
  "damageVulnerabilities": [
    "area effects"
  ],
  "damageResistances": [
    "bludgeoning",
    "piercing",
    "slashing"
  ],
  "damageImmunities": [],
  "conditionImmunities": [
    "charmed",
    "frightened",
    "grappled",
    "paralyzed",
    "petrified",
    "prone",
    "restrained",
    "stunned"
  ],
  "senses": {
    "darkvision": 30,
    "passivePerception": 8
  },
  "languages": "",
  "challengeRating": 0.5,
  "specialAbilities": [
    {
      "name": "Swarm",
      "attackBonus": 0,
      "damageDice": "0d0",
      "damageBonus": 0,
      "damageType": "The swarm can occupy another creature\u2019s space and vice versa, and the swarm can move through any opening large enough for a Tiny spider. The swarm can\u2019t regain hit points or gain temporary hit points."
    },
    {
      "name": "Spider Climb",
      "attackBonus": 0,
      "damageDice": "0d0",
      "damageBonus": 0,
      "damageType": "The swarm can climb difficult surfaces, including upside down on ceilings, without needing to make an ability check."
    }
  ],
  "actions": [
    {
      "name": "Bites",
      "attackBonus": 3,
      "damageDice": "4d4",
      "damageBonus": 0,
      "damageType": "piercing"
    }
  ],
  "legendaryActions": [],
  "condition": "Alive"
}