{
  "name": "Ghoul",
  "size": "Medium",
  "type": "Undead",
  "alignment": "Chaotic Evil",
  "armorClass": 12,
  "hitPoints": 22,
  "maxHitPoints": 22,
  "speed": 30,
  "abilities": {
    "strength": 13,
    "dexterity": 15,
    "constitution": 10,
    "intelligence": 7,
    "wisdom": 10,
    "charisma": 6
  },
  "savingThrows": [],
  "skills": {},
  "damageVulnerabilities": [],
  "damageResistances": [],
  "damageImmunities": [],
  "conditionImmunities": [
    "Poisoned"
  ],
  "senses": {
    "darkvision": 60,
    "passivePerception": 10
  },
  "languages": "Common",
  "challengeRating": 1,
  "specialAbilities": [
    {
      "name": "Undead Fortitude",
      "attackBonus": 0,
      "damageDice": "",
      "damageBonus": 0,
      "damageType": "None"
    },
    {
      "name": "Turn Immunity",
      "attackBonus": 0,
      "damageDice": "",
      "damageBonus": 0,
      "damageType": "None"
    }
  ],
  "actions": [
    {
      "name": "Bite",
      "attackBonus": 2,
      "damageDice": "2d6",
      "damageBonus": 0,
      "damageType": "Piercing"
    },
    {
      "name": "Claws",
      "attackBonus": 4,
      "damageDice": "2d4",
      "damageBonus": 2,
      "damageType": "Slashing"
    }
  ],
  "legendaryActions": [],
  "condition": "Alive"
}